M050079,Manhattan,1,05,135,EAST 57 STREET,10022,"135 EAST 57 STREET, New York, NY 10022",01312,0015,,Northwest corner of East 57th Street and Lexington Avenue,1987,32,,"61/82",Completed,Commercial,,,Open Park Space; Plaza,No,No,No,No,No,Yes,No,No,No,No,No,No,No,Yes,Open Park Space,Madison Lexington Venture,Kohn Pedersen Fox,"Kohn Pedersen Fox; Thomas Balsley Associates (for Open Park Space, west of building)",Open Park Space 2500.00 sf; Plaza 4820.00 sf,24 Hours; Restricted Hours,Open Park Space: Restricted Hours (8:00 am to sunset; 24 Hours: Open Park Space located at northwest corner of East 57th Street and Lexington Avenue); Plaza: 24 Hours,Yes,8:00 am to sunset; 24 Hours: Open Park Space located at northwest corner of East 57th Street and Lexington Avenue,,"Food Service; Lighting; Litter Receptacles; Other Required; Planting; Plaque/Sign; Seating; Tables; Trees within Space; Water Feature","Open Park Space: Food Service (kiosk open between April 15 and October 15, from 8:00 am to 5:00 pm); Open Park Space: Lighting (8 foot candles; Plaza: 8 foot candles); Open Park Space: Planting (96 sf); Open Park Space: Plaque/Sign; Open Park Space: Seating (48 linear feet of fixed benches, 14 movable chairs); Open Park Space: Tables (2); Open Park Space: Trees within Space (12); Open Park Space: Water Feature (fountain wall and water basin); Plaza: Lighting (8 foot candles); Plaza: Litter Receptacles; Plaza: Other Required (tempietto); Plaza: Seating (93 linear feet of fixed seating); Plaza: Water Feature (fountains)",,,,,,,,"kiosk open between April 15 and October 15, from 8:00 am to 5:00 pm",8 foot candles; Plaza: 8 foot candles; 8 foot candles,Yes,96 sf,Yes,,,,"48 linear feet of fixed benches, 14 movable chairs; 93 linear feet of fixed seating",,2,,12,fountain wall and water basin; fountains,tempietto,,,,,"Full/Partial",40.761349,-73.969400 ,0992727,0216658
M050081,Manhattan,1,05,235,WEST 48 STREET,10036,"235 WEST 48 STREET, New York, NY 10036",01020,0005,Ritz,North side of West 48th Street between Broadway and Eighth Avenue,1989,40,,"53/87",Completed,Residential,,,Urban Plaza,No,No,No,No,No,No,No,No,No,No,No,No,Yes,No,,Jason Carter,Schuman Lichtenstein Claman Efron,Schuman Lichtenstein Claman Efron; Thomas Balsley Associates (for alterations circa 2000 and 2009),Urban Plaza 6690.42 sf,Restricted Hours,"Urban Plaza: Restricted Hours (May 1 through September 30, 7:00 am to 11:30 pm, October 1 through April 30, 7:00 am to 7:00 pm; also open whenever the open air café at the rear of the Urban Plaza is in operation)",,"May 1 through September 30, 7:00 am to 11:30 pm, October 1 through April 30, 7:00 am to 7:00 pm; also open whenever the open air café at the rear of the Urban Plaza is in operation",,"Artwork; Lighting; Litter Receptacles; Planting; Plaque/Sign; Retail Frontage; Seating; Tables; Trees on Street; Trees within Space; Water Feature","Urban Plaza: Artwork (Firefighters Memorial); Urban Plaza: Lighting; Urban Plaza: Litter Receptacles (4 cubic feet); Urban Plaza: Planting (960 sf); Urban Plaza: Plaque/Sign (2 entry plaques, 1 informational plaque, 1 hours of access plaque); Urban Plaza: Retail Frontage; Urban Plaza: Seating (283 linear feet including 257 lf with backs); Urban Plaza: Tables (8); Urban Plaza: Trees on Street (17); Urban Plaza: Trees within Space (12); Urban Plaza: Water Feature (Firefighters Memorial with water)",,Firefighters Memorial,,,,,,,Yes,4 cubic feet,960 sf,"2 entry plaques, 1 informational plaque, 1 hours of access plaque",,,Yes,283 linear feet including 257 lf with backs,,8,17,12,Firefighters Memorial with water,,,,,,"Full/Partial",40.760894,-73.986092 ,0988103,0216491
M050082,Manhattan,1,05,420,FIFTH AVENUE,10018,"420 FIFTH AVENUE, New York, NY 10018",00839,7501,,Full blockfront on west side of Fifth Avenue between West 37th and 38th Streets,1989,28,,"44/88",Completed,"Co-op/Condo; Commercial",,,Urban Plaza,No,No,No,No,No,No,No,No,No,No,No,No,Yes,No,,Hammerson Property Corp.,Brennan Beer Gorman,M. Paul Friedberg & Partners,Urban Plaza 3765.00 sf,24 Hours,Urban Plaza: 24 Hours,Yes,,,"Lighting; Litter Receptacles; Planting; Plaque/Sign; Retail Frontage; Seating; Trees on Street; Trees within Space","Urban Plaza: Lighting; Urban Plaza: Litter Receptacles (1.88 cubic feet required, 15.74 cf provided); Urban Plaza: Planting (665 sf); Urban Plaza: Plaque/Sign (2); Urban Plaza: Retail Frontage (60 linear feet); Urban Plaza: Seating (126 linear feet including 70.87 lf with backs required, 150.25 lf including 78.67 lf with backs and 21 movable chairs provided); Urban Plaza: Trees on Street (14); Urban Plaza: Trees within Space (7 required, 9 provided)",,,,,,,,,Yes,"1.88 cubic feet required, 15.74 cf provided",665 sf,2,,,60 linear feet,"126 linear feet including 70.87 lf with backs required, 150.25 lf including 78.67 lf with backs and 21 movable chairs provided",,,14,"7 required, 9 provided",,,,,,,"Full/Partial",40.750812,-73.983336 ,0988867,0212818
M050083,Manhattan,1,05,1325,SIXTH AVENUE,10019,"1325 SIXTH AVENUE, New York, NY 10019",01006,0013,1325 Avenue of the Americas,North side of  West 53rd Street and south side of West 54th Street between Sixth and Seventh Avenues,1989,34,,"58/87",Completed,Commercial,,,Through Block Galleria,No,No,No,No,No,No,No,No,No,No,No,Yes,No,No,,"Minskoff Equities/A. Taubman",Kohn Pedersen Fox,Kohn Pedersen Fox,Through Block Galleria 6781.49 sf,Restricted Hours,"Through Block Galleria: Restricted Hours (8:00 am to 7:00 pm, closed January 1, July 4, and December 25)",,"8:00 am to 7:00 pm, closed January 1, July 4, and December 25",,"Lighting; Litter Receptacles; Other Required; Plaque/Sign; Retail Frontage; Seating; Tables","Through Block Galleria: Lighting; Through Block Galleria: Litter Receptacles; Through Block Galleria: Other Required (skylight over 3,439.68 sf of Through Block Galleria); Through Block Galleria: Plaque/Sign (4); Through Block Galleria: Retail Frontage; Through Block Galleria: Seating (189.07 linear feet including 94.54 lf fixed seating required, 209.3 lf including 14 benches totaling 125 lf and 56 movable chairs totaling 84 lf provided); Through Block Galleria: Tables (14)",,,,,,,,,Yes,Yes,,4,,,Yes,"189.07 linear feet including 94.54 lf fixed seating required, 209.3 lf including 14 benches totaling 125 lf and 56 movable chairs totaling 84 lf provided",,14,,,,"skylight over 3,439.68 sf of Through Block Galleria",,,,,"Full/Partial",40.762880,-73.980702 ,0989596,0217215
M050084,Manhattan,1,05,1755,BROADWAY,10019,"1755 BROADWAY, New York, NY 10019",01028,7501,Symphony House,Full blockfront on West 56th Street between Broadway and Eighth Avenues,1987,45,,"83/84",Completed,Commercial; Residential,,,Urban Plaza,No,No,No,No,No,No,No,No,No,No,No,No,Yes,No,,Jack Resnick,Emery Roth & Sons,Thomas Balsley Associates,Urban Plaza 4953.89 sf,Restricted Hours,"Urban Plaza: Restricted Hours (May 1 through September 30, 7:00 am to 9:30 pm, October 1 through April 30, 7:00 am to 7:30 pm; also open whenever the open air café is in operation)",,"May 1 through September 30, 7:00 am to 9:30 pm, October 1 through April 30, 7:00 am to 7:30 pm; also open whenever the open air café is in operation",,"Lighting; Litter Receptacles; Planting; Plaque/Sign; Retail Frontage; Seating; Trees on Street; Trees within Space","Urban Plaza: Lighting; Urban Plaza: Litter Receptacles (15 cubic feet); Urban Plaza: Planting (1206 sf); Urban Plaza: Plaque/Sign (1 entry plaque and 1 information plaque required, 2 entry plaques and 1 information plaque provided); Urban Plaza: Retail Frontage; Urban Plaza: Seating (165.5 linear feet including 62 lf with backs required, 168.5 lf including 142 lf with backs provided); Urban Plaza: Trees on Street (8 on West 56th Street); Urban Plaza: Trees within Space (8 required, 10 provided)",,,,,,,,,Yes,15 cubic feet,1206 sf,"1 entry plaque and 1 information plaque required, 2 entry plaques and 1 information plaque provided",,,Yes,"165.5 linear feet including 62 lf with backs required, 168.5 lf including 142 lf with backs provided",,,8 on West 56th Street,"8 required, 10 provided",,,Open Air Cafe,Urban Plaza: Open Air Cafe (340 sf in the middle of the east side of the Urban Plaza),340 sf in the middle of the east side of the Urban Plaza,,"Full/Partial",40.765974,-73.982553 ,0989083,0218342
M050085,Manhattan,1,05,146,WEST 57 STREET,10019,"146 WEST 57 STREET, New York, NY 10019",01009,7501,Metropolitan Tower,South side of West 57th Street between Sixth and Seventh Avenues,1986,78,,"38/83",Completed,"Co-op/Condo; Residential",,,Through Block Connection; Urban Plaza,No,No,No,No,No,No,No,No,No,No,Yes,No,Yes,No,,Harry Macklowe,Schuman Lichtenstein Claman Efron,Schuman Lichtenstein Claman Efron,Through Block Connection 0.00 sf; Urban Plaza 4375.00 sf,24 Hours; Restricted Hours,"Through Block Connection: Restricted Hours (8:00 am to 7:00 pm, on days the building is open for business); Urban Plaza: 24 Hours",Yes,"8:00 am to 7:00 pm, on days the building is open for business",,"Lighting; Litter Receptacles; Planting; Plaque/Sign; Retail Frontage; Seating; Trees on Street; Trees within Space","Through Block Connection: Lighting; Through Block Connection: Planting; Through Block Connection: Plaque/Sign (2); Urban Plaza: Lighting; Urban Plaza: Litter Receptacles (2.2 cubic feet required, 3 cf provided); Urban Plaza: Planting; Urban Plaza: Plaque/Sign (1); Urban Plaza: Retail Frontage (29 linear feet); Urban Plaza: Seating (110 linear feet including 6.33 lf with backs required, 196 lf including 20 lf with backs provided); Urban Plaza: Trees on Street (17); Urban Plaza: Trees within Space (4)",,,,,,,,,Yes,"2.2 cubic feet required, 3 cf provided",Yes,2; 1,,,29 linear feet,"110 linear feet including 6.33 lf with backs required, 196 lf including 20 lf with backs provided",,,17,4,,,,,,,"Full/Partial",40.764719,-73.979290 ,0989987,0217885
M050086,Manhattan,1,05,65,EAST 55 STREET,10022,"65 EAST 55 STREET, New York, NY 10022",01291,0028,Park Avenue Tower,North side of East 55th Street between Park and Madison Avenues,1985,38,,"12/82",Completed,Commercial,,North side of East 55th Street between Park and Madison Avenues,Urban Plaza,No,No,No,No,No,No,No,No,No,No,No,No,Yes,No,,Park Tower Realty,"Murphy/Jahn","Murphy/Jahn, MdeAs (2016 redesign)",Urban Plaza 6437.17 sf,24 Hours,Urban Plaza: 24 Hours,Yes,,,"Artwork; Bicycle Parking; Drinking Fountain; Lighting; Litter Receptacles; Planting; Plaque/Sign; Retail Frontage; Seating; Trees on Street; Trees within Space","Urban Plaza: Artwork (1 Artwork); Urban Plaza: Bicycle Parking (1 bike rack with 2 spaces on sidewalk); Urban Plaza: Drinking Fountain (1); Urban Plaza: Lighting; Urban Plaza: Litter Receptacles (4); Urban Plaza: Planting (763 SF); Urban Plaza: Plaque/Sign (2 entry plaques, 1 information plaque); Urban Plaza: Retail Frontage; Urban Plaza: Seating (395 LF provided including 88 LF of movable.); Urban Plaza: Trees on Street (8); Urban Plaza: Trees within Space (10)",,1 Artwork,1 bike rack with 2 spaces on sidewalk,,1,,,,Yes,4,763 SF,"2 entry plaques, 1 information plaque",,,Yes,395 LF provided including 88 LF of movable.,,,8,10,,,,,,,"Full/Partial",40.760886,-73.972133 ,0991970,0216489
M050087,Manhattan,1,05,383,MADISON AVENUE,10179,"383 MADISON AVENUE, New York, NY 10179",01282,0021,Bear Stearns,Full block bounded by Madison and Vanderbilt Avenues and East 46th and 47th Streets,1999,45,,,Completed,Commercial,,,Building Entrance Recess Area; New North End Access to 47th Street Cro; Off-Street Rail Mass Transit Access; Through Block Connection,No,No,No,No,No,No,No,No,No,No,Yes,No,No,Yes,Building Entrance Recess Area; New North End Access to 47th Street Cro; Off-Street Rail Mass Transit Access,Sterling Equities (Fred Wilpon),"Skidmore, Owings & Merrill","Skidmore, Owings & Merrill",Building Entrance Recess Area 0.00 sf; New North End Access to 47th Street Cro 707.00 sf; Off-Street Rail Mass Transit Access 5031.00 sf; Through Block Connection 5706.00 sf,24 Hours; Restricted Hours,"Building Entrance Recess Area: 24 Hours; Off-Street Rail Mass Transit Access: Restricted Hours (Daily, 5:30 am to 11:30 pm, or as otherwise specified by the MTA)",Yes,"Daily, 5:30 am to 11:30 pm, or as otherwise specified by the MTA",,"Artwork; Escalator; Lighting; Other Required; Planting; Plaque/Sign","New North End Access to 47th Street Cro: Escalator (2 escalators connecting Off-Street Rail Mass Transit Access Improvement to New North End Access to 47th Street Cross Passageway); New North End Access to 47th Street Cro: Other Required (stairway connecting Off-Street Rail Mass Transit Access Improvement and New North End Access to 47th Street Cross Passageway); Off-Street Rail Mass Transit Access: Artwork (restored historic mosaic displayed above escalators to New North End Access to 47th Street Cross Passageway); Off-Street Rail Mass Transit Access: Escalator (2 escalators connecting Off-Street Rail Mass Transit Access Improvement to New North End Access to 47th Street Cross Passageway); Off-Street Rail Mass Transit Access: Other Required (stairway connecting Off-Street Rail Mass Transit Access Improvement and New North End Access to 47th Street Cross Passageway); Off-Street Rail Mass Transit Access: Planting (25 decorative planters with seasonal landscaping displays); Through Block Connection: Lighting (lobby lighting designed to cast light onto adjacent sidewalks); Through Block Connection: Planting (25 decorative planters with seasonal landscaping displays); Through Block Connection: Plaque/Sign (8 at street level)",,restored historic mosaic displayed above escalators to New North End Access to 47th Street Cross Passageway,,,,,2 escalators connecting Off-Street Rail Mass Transit Access Improvement to New North End Access to 47th Street Cross Passageway; 2 escalators connecting Off-Street Rail Mass Transit Access Improvement to New North End Access to 47th Street Cross Passageway,,lobby lighting designed to cast light onto adjacent sidewalks,,25 decorative planters with seasonal landscaping displays; 25 decorative planters with seasonal landscaping displays,8 at street level,,,,,,,,,,stairway connecting Off-Street Rail Mass Transit Access Improvement and New North End Access to 47th Street Cross Passageway; stairway connecting Off-Street Rail Mass Transit Access Improvement and New North End Access to 47th Street Cross Passageway,,,,,"Full/Partial",40.755469,-73.976726 ,0990698,0214515
M050088,Manhattan,1,05,31,WEST 52 STREET,10019,"31 WEST 52 STREET, New York, NY 10019",01268,7501,Deutsche Bank,North side of West 52nd Street between Fifth and Sixth Avenues,1985,29,,,Completed,Commercial,,,Urban Plaza,No,No,No,No,No,No,No,No,No,No,No,No,Yes,No,,Gerald D. Hines,Kevin Roche John Dinkeloo and Associates,Kevin Roche John Dinkeloo and Associates,Urban Plaza 7654.00 sf,24 Hours,Urban Plaza: 24 Hours,Yes,,,"Artwork; Lighting; Litter Receptacles; Planting; Plaque/Sign; Retail Frontage; Seating; Trees on Street; Trees within Space","Urban Plaza: Artwork (granite sculpture); Urban Plaza: Lighting (2.3 lumens); Urban Plaza: Litter Receptacles (6.1 cubic feet required, 12 cf provided); Urban Plaza: Planting; Urban Plaza: Plaque/Sign (2); Urban Plaza: Retail Frontage; Urban Plaza: Seating (308 linear feet required, 311 lf provided); Urban Plaza: Trees on Street (3); Urban Plaza: Trees within Space (6 required, 10 provided)",,granite sculpture,,,,,,,2.3 lumens,"6.1 cubic feet required, 12 cf provided",Yes,2,,,Yes,"308 linear feet required, 311 lf provided",,,3,"6 required, 10 provided",,,Open Air Cafe,"Urban Plaza: Open Air Cafe (N 190215, Expires 06/24/2022)","N 190215, Expires 06/24/2022",,"Full/Partial",40.760925,-73.978013 ,0990341,0216503
M050089,Manhattan,1,05,40,EAST 52 STREET,10022,"40 EAST 52 STREET, New York, NY 10022",01287,0028,,South side of East 52nd Street between Park and Madison Avenues,1986,23,,,Completed,Commercial,,,Urban Plaza,No,No,No,No,No,No,No,No,No,No,No,No,Yes,No,,Jack and Lewis Rudin,The Eggers Group,The Eggers Group,Urban Plaza 4124.88 sf,24 Hours,Urban Plaza: 24 Hours,Yes,,,"Lighting; Litter Receptacles; Plaque/Sign; Retail Frontage; Seating; Trees on Street; Trees within Space; Water Feature","Urban Plaza: Lighting; Urban Plaza: Litter Receptacles (2 cubic feet); Urban Plaza: Plaque/Sign (2 entry, 2 information); Urban Plaza: Retail Frontage; Urban Plaza: Seating (138 linear feet including 7 lf with backs required, 154.5 lf including 35 lf with backs provided); Urban Plaza: Trees on Street (10); Urban Plaza: Trees within Space (4); Urban Plaza: Water Feature (pool and fountain)",,,,,,,,,Yes,2 cubic feet,,"2 entry, 2 information",,,Yes,"138 linear feet including 7 lf with backs required, 154.5 lf including 35 lf with backs provided",,,10,4,pool and fountain,,,,,,"Full/Partial",40.758474,-73.974097 ,0991426,0215610
M050090,Manhattan,1,05,145,WEST 44 STREET,10036,"145 WEST 44 STREET, New York, NY 10036",00997,0010,Millennium Broadway,North side of West 44th Street between Sixth Avenue and Broadway,1990,47,,"47/87",Completed,Hotel,,,Through Block Connection,No,No,No,No,No,No,No,No,No,No,Yes,No,No,No,,Harry Macklowe,"Gruzen Samton Steinglass/ Perkins & Will","Gruzen Samton Steinglass/ Perkins & Will",Through Block Connection 3012.00 sf,Restricted Hours,"Through Block Connection: Restricted Hours (8:00 am to 7:00 pm, on days the building is open for business)",,"8:00 am to 7:00 pm, on days the building is open for business",,"Lighting; Plaque/Sign","Through Block Connection: Lighting (minimum 5 foot candles); Through Block Connection: Plaque/Sign (1 at each entry)",,,,,,,,,minimum 5 foot candles,,,1 at each entry,,,,,,,,,,,,,,,"Full/Partial",40.757155,-73.984645 ,0988504,0215129
M050091,Manhattan,1,05,1535,BROADWAY,10036,"1535 BROADWAY, New York, NY 10036",01017,0029,Marriott Marquis,West side of Broadway between West 45th and 46th Streets,1985,54,,,Completed,Hotel,,,Broadway Plaza; Covered Public Pedestrian Area; Interior Spaces; Shubert Alley Extension,No,No,No,No,No,No,No,No,No,No,No,No,No,Yes,Broadway Plaza; Covered Public Pedestrian Area; Interior Spaces; Shubert Alley Extension,Portman Properties,John Portman,John Portman,Broadway Plaza 4000.00 sf; Covered Public Pedestrian Area 24950.00 sf; Interior Spaces 40300.00 sf; Shubert Alley Extension 4970.00 sf,24 Hours; Restricted Hours,Broadway Plaza: 24 Hours; Covered Public Pedestrian Area: 24 Hours; Interior Spaces: 24 Hours; Shubert Alley Extension: Restricted Hours (7:00 am to midnight),Yes,7:00 am to midnight,,"Climate Control; Elevator; Other Required; Plaque/Sign; Retail Frontage","Broadway Plaza: Retail Frontage (restaurant); Covered Public Pedestrian Area: Elevator (elevators connecting Interior Spaces and Covered Public Pedestrian Area); Interior Spaces: Climate Control; Interior Spaces: Elevator (elevators connecting Interior Spaces and Covered Public Pedestrian Area); Interior Spaces: Other Required (imate theater of at least 1,050 seats; not less than $50,000 for renovation of 46th Street theater; entrances from Shubert Alley Extension to hotel lobby and retail above); Shubert Alley Extension: Plaque/Sign (at both ends); Shubert Alley Extension: Retail Frontage (retail spaces and displays)",,,,Yes,,elevators connecting Interior Spaces and Covered Public Pedestrian Area; elevators connecting Interior Spaces and Covered Public Pedestrian Area,,,,,,at both ends,,,restaurant; retail spaces and displays,,,,,,,"imate theater of at least 1,050 seats; not less than $50,000 for renovation of 46th Street theater; entrances from Shubert Alley Extension to hotel lobby and retail above",,,,,"Full/Partial",40.758627,-73.986197 ,0988074,0215665
M050092,Manhattan,1,05,489,FIFTH AVENUE,10017,"489 FIFTH AVENUE, New York, NY 10017",01276,0004,,East side of Fifth Avenue between East 41st and 42nd Streets,1972,34,,"110/68",Completed,Commercial,,,Arcade,Yes,No,No,No,No,No,No,No,No,No,No,No,No,No,,,Kahn and Jacobs,Kahn and Jacobs,Arcade 510.00 sf,24 Hours,Arcade: 24 Hours,Yes,,,None,Arcade: None,Yes,,,,,,,,,,,,,,,,,,,,,,,,,,"Full/Partial",40.752936,-73.980741 ,0989586,0213592
M050093,Manhattan,1,05,407,PARK AVENUE SOUTH,10016,"407 PARK AVENUE SOUTH, New York, NY 10016",00884,0001,Ascot,Northeast corner of East 28th Street and Park Avenue South,1984,26,,"5/83",Completed,"Co-op/Condo; Residential",,,Residential Plaza,No,No,No,No,No,No,No,Yes,No,No,No,No,No,No,,,Philip Birnbaum & Associates,Thomas Balsley Associates,Residential Plaza 3686.07 sf,Restricted Hours,"Residential Plaza: Restricted Hours (8:00 am to 8:00 pm or dark, whichever is later)",,"8:00 am to 8:00 pm or dark, whichever is later",,"Bicycle Parking; Drinking Fountain; Lighting; Litter Receptacles; Planting; Plaque/Sign; Seating; Trees on Street; Trees within Space","Residential Plaza: Bicycle Parking (Primary Space: 4 spaces); Residential Plaza: Drinking Fountain (Primary Space: 1); Residential Plaza: Lighting; Residential Plaza: Litter Receptacles (Primary Space: 4.4 cubic feet); Residential Plaza: Planting (Primary Space: 330 sf required, 376 sf provided; Visual Residual Space: 1,030.69 sf required, 1,024.2 sf provided); Residential Plaza: Plaque/Sign; Residential Plaza: Seating (Primary Space: 73.72 linear feet including 7.37 lf with backs required, 94.0 lf including 36.0 lf with backs provided); Residential Plaza: Trees on Street (6); Residential Plaza: Trees within Space (Primary Space: 4)",,,Primary Space: 4 spaces,,Primary Space: 1,,,,Yes,Primary Space: 4.4 cubic feet,"Primary Space: 330 sf required, 376 sf provided; Visual Residual Space: 1,030.69 sf required, 1,024.2 sf provided",Yes,,,,"Primary Space: 73.72 linear feet including 7.37 lf with backs required, 94.0 lf including 36.0 lf with backs provided",,,6,Primary Space: 4,,,,,,,"Full/Partial",40.743374,-73.983627 ,0988787,0210108
M050094,Manhattan,1,05,45,EAST 25 STREET,10010,"45 EAST 25 STREET, New York, NY 10010",00855,7501,Stanford,North side of East 25th Street between Park Avenue South and Madison Avenue,1986,41,,"75/84",Completed,"Co-op/Condo; Residential",,,Plaza,No,No,No,No,No,Yes,No,No,No,No,No,No,No,No,,,Liebman Liebman Associates,Liebman Liebman Associates,Plaza 2000.40 sf,24 Hours,Plaza: 24 Hours,Yes,,,None,Plaza: None,Yes,,,,,,,,,,,,,,,,,,,,,,,,,,"Full/Partial",40.742024,-73.986164 ,0988084,0209616
M050095,Manhattan,1,05,12,EAST 49 STREET,10017,"12 EAST 49 STREET, New York, NY 10017",01284,0007,Tower 49,South side of East 49th Street between Madison and Fifth Avenues,1984,44,,"62/81",Completed,Commercial,,,Arcade; Public Access Passageway; Sidewalk Widening; Urban Plaza,Yes,No,No,No,No,No,No,No,Yes,No,No,No,Yes,Yes,Public Access Passageway,Solstead Associates (David and Jean Solomon),"Skidmore, Owings & Merrill","Skidmore, Owings & Merrill; Thomas Balsley Associates (for alteration in 2004)",Arcade 3779.00 sf; Public Access Passageway 0.00 sf; Sidewalk Widening 998.00 sf; Urban Plaza 6387.00 sf,24 Hours; Restricted Hours,"Arcade: 24 Hours; Public Access Passageway: Restricted Hours (Public Access Passageway: Monday through Friday, 8:00 am to 6:00 pm); Sidewalk Widening: 24 Hours; Urban Plaza: 24 Hours",Yes,"Public Access Passageway: Monday through Friday, 8:00 am to 6:00 pm",,"Lighting; Litter Receptacles; Planting; Plaque/Sign; Seating; Tables; Trees on Street; Trees within Space","Public Access Passageway: Plaque/Sign (Public Access Passageway: 1 at each entrance; Urban Plaza: 3 on East 48th Street); Sidewalk Widening: Trees on Street (13); Urban Plaza: Lighting; Urban Plaza: Litter Receptacles (Urban Plaza: 4 on East 48th Street, 1 on East 49th Street); Urban Plaza: Planting; Urban Plaza: Plaque/Sign (Urban Plaza: 3 on East 48th Street); Urban Plaza: Seating (Urban Plaza: 403 linear feet including 290.3 lf (includes 30 movable chairs) on East 48th Street and 64.5 lf with backs and 6 eight-foot benches on East 49th Street); Urban Plaza: Tables (Urban Plaza: 6 on East 48th Street); Urban Plaza: Trees within Space (Urban Plaza: 6 on East 48th Street, 4 on East 49th Street)",,,,,,,,,Yes,"Urban Plaza: 4 on East 48th Street, 1 on East 49th Street",Yes,Public Access Passageway: 1 at each entrance; Urban Plaza: 3 on East 48th Street; Urban Plaza: 3 on East 48th Street,,,,Urban Plaza: 403 linear feet including 290.3 lf (includes 30 movable chairs) on East 48th Street and 64.5 lf with backs and 6 eight-foot benches on East 49th Street,,Urban Plaza: 6 on East 48th Street,13,"Urban Plaza: 6 on East 48th Street, 4 on East 49th Street",,,,,,,"Full/Partial",40.757231,-73.977022 ,0990616,0215157
