M040011,Manhattan,1,04,525,EIGHTH AVENUE,10018,"525 EIGHTH AVENUE, New York, NY 10018",00760,0039,,Northwest corner of Eighth Avenue and W 36th Street.,2019,29,,,Completed,Hotel,,Fronting Eighth Avenue,Public Plaza,No,No,No,No,No,No,Yes,No,No,No,No,No,No,No,,LSCH LLC,Gene Kaufman Architect,Gene Kaufman Architect,Public Plaza 2408.50 sf,24 Hours,Public Plaza: 24 Hours,Yes,,,"Bicycle Parking; Drinking Fountain; Lighting; Litter Receptacles; Planting; Plaque/Sign; Retail Frontage; Seating; Tables; Trees within Space","Public Plaza: Bicycle Parking (2 bicycle parking spots); Public Plaza: Drinking Fountain (1); Public Plaza: Lighting; Public Plaza: Litter Receptacles (2); Public Plaza: Planting (521.89 sf total of planting beds provided); Public Plaza: Plaque/Sign; Public Plaza: Retail Frontage (49' - 4 1/4"" provided); Public Plaza: Seating (103.98 LF of seating provided including: fixed benches with backs; fixed benches without backs; 14 movable chairs); Public Plaza: Tables (5 tables provided: 3 round and 2 rectangular); Public Plaza: Trees within Space (4)",,,2 bicycle parking spots,,1,,,,Yes,2,521.89 sf total of planting beds provided,Yes,,,"49' - 4 1/4"" provided",103.98 LF of seating provided including: fixed benches with backs; fixed benches without backs; 14 movable chairs,,5 tables provided: 3 round and 2 rectangular,,4,,,,,,,"Full/Partial",40.753821,-73.992669 ,0986358,0213862
M050002,Manhattan,1,05,36,CENTRAL PARK SOUTH,10019,"36 CENTRAL PARK SOUTH, New York, NY 10019",01274,0011,Park Lane Hotel,South side of Central Park South between Fifth and Sixth Avenues,1971,43,,"42/67",Completed,Hotel,,North side of West 58th Street between Fifth and Sixth Avenues,Arcade; Plaza,Yes,No,No,No,No,Yes,No,No,No,No,No,No,No,No,,,Emery Roth & Sons,Emery Roth & Sons,Arcade 2098.00 sf; Plaza 1958.00 sf,24 Hours,Arcade: 24 Hours; Plaza: 24 Hours,Yes,,,None; Trees on Street,Arcade: None; Plaza: Trees on Street (on Central Park South),Yes,,,,,,,,,,,,,,,,,,on Central Park South,,,,,,,,"Full/Partial",40.764811,-73.975409 ,0991062,0217919
M050003,Manhattan,1,05,767,FIFTH AVENUE,10153,"767 FIFTH AVENUE, New York, NY 10153",01294,0001,General Motors Building,East side of Fifth Avenue between East 58th and 59th Streets,1968,50,,"11/65",Completed,Commercial,,East side of Fifth Avenue and west side of Madison Avenue between East 58th and 59th Streets,Arcade; Plaza,Yes,No,No,No,No,Yes,No,No,No,No,No,No,No,No,,,Edward Durell Stone,Edward Durell Stone; Thomas Balsley Associates (for alteration in 1999); Moed de Armas & Shannon Architects P.C. (for alteration in 2004 and 2011); MPFP & Mathews Nielsen (for design change and reduction in 2017),Arcade 1971.00 sf; Plaza 19730.00 sf,24 Hours,Arcade: 24 Hours; Plaza: 24 Hours,Yes,,,"Artwork; Lighting; Litter Receptacles; None; Planting; Plaque/Sign; Retail Frontage; Seating; Tables; Trees within Space; Water Feature","Arcade: None; Plaza: Artwork (Art Objects); Plaza: Lighting (average 2 foot candles); Plaza: Litter Receptacles (8 total at 51 gallons); Plaza: Planting (504 sf total in planting beds. 252 sf each planting bed.); Plaza: Plaque/Sign (2 Plaques provided); Plaza: Retail Frontage (124'-8""); Plaza: Seating (626 LF in total provided Including 104 movable chairs, fixed benches with backs, fixed benches without backs and seat walls.); Plaza: Tables (26 movable tables); Plaza: Trees within Space (28 trees total); Plaza: Water Feature (2 Linear water features (163 sf each, includes 120 sf for traverse paths))",Yes,Art Objects,,,,,,,average 2 foot candles,8 total at 51 gallons,504 sf total in planting beds. 252 sf each planting bed.,2 Plaques provided,,,"124'-8""","626 LF in total provided Including 104 movable chairs, fixed benches with backs, fixed benches without backs and seat walls.",,26 movable tables,,28 trees total,"2 Linear water features (163 sf each, includes 120 sf for traverse paths)",,,,,,"Full/Partial",40.763609,-73.972435 ,0991886,0217481
M050004,Manhattan,1,05,500,PARK AVENUE,10022,"500 PARK AVENUE, New York, NY 10022",01294,0037,500 Park Tower,Southwest corner of Park Avenue and East 59th Street,1984,42,,,Completed,"Co-op/Condo; Commercial; Residential",,,Arcade; Sidewalk Widening; Urban Plaza,Yes,No,No,No,No,No,No,No,Yes,No,No,No,Yes,No,,500 Park Avenue Associates,"James Stewart Polshek & Associates/Schuman Lichtenstein Claman & Efron/Skidmore, Owings & Merrill","James Stewart Polshek & Associates/Schuman Lichtenstein Claman & Efron/Skidmore, Owings & Merrill",Arcade 2695.00 sf; Sidewalk Widening 1173.40 sf; Urban Plaza 1479.00 sf,24 Hours,Arcade: 24 Hours; Sidewalk Widening: 24 Hours; Urban Plaza: 24 Hours,Yes,,,"Lighting; None; Planting; Plaque/Sign; Retail Frontage; Trees on Street","Arcade: None; Sidewalk Widening: Trees on Street (8 on East 59th Street); Urban Plaza: Lighting; Urban Plaza: Planting; Urban Plaza: Plaque/Sign; Urban Plaza: Retail Frontage",Yes,,,,,,,,Yes,,Yes,Yes,,,Yes,,,,8 on East 59th Street,,,,,,,,"Full/Partial",40.762894,-73.970356 ,0992462,0217221
M050005,Manhattan,1,05,499,PARK AVENUE,10022,"499 PARK AVENUE, New York, NY 10022",01313,0004,,Southeast corner of Park Avenue and East 59th Street,1980,27,,"27/77",Completed,Commercial,,,Glass-Enclosed Urban Plaza Equivalent; Open Urban Plaza Equivalent; Sidewalk Widening Equivalent; Through Block Arcade Equivalent,No,No,No,No,No,No,No,No,No,No,No,No,No,Yes,Glass-Enclosed Urban Plaza Equivalent; Open Urban Plaza Equivalent; Sidewalk Widening Equivalent; Through Block Arcade Equivalent,,I.M. Pei and Partners,I.M. Pei and Partners,Glass-Enclosed Urban Plaza Equivalent 1450.00 sf; Open Urban Plaza Equivalent 525.00 sf; Sidewalk Widening Equivalent 487.00 sf; Through Block Arcade Equivalent 1540.00 sf,24 Hours,Glass-Enclosed Urban Plaza Equivalent: 24 Hours; Open Urban Plaza Equivalent: 24 Hours; Sidewalk Widening Equivalent: 24 Hours; Through Block Arcade Equivalent: 24 Hours,Yes,,,"Lighting; None; Plaque/Sign; Seating; Trees within Space","Glass-Enclosed Urban Plaza Equivalent: Lighting; Glass-Enclosed Urban Plaza Equivalent: Seating (bench); Glass-Enclosed Urban Plaza Equivalent: Trees within Space; Open Urban Plaza Equivalent: Plaque/Sign; Sidewalk Widening Equivalent: None; Through Block Arcade Equivalent: None",Yes,,,,,,,,Yes,,,Yes,,,,bench,,,,Yes,,,,,,,"Full/Partial",40.762540,-73.969605 ,0992670,0217092
M050006,Manhattan,1,05,110,EAST 59 STREET,10022,"110 EAST 59 STREET, New York, NY 10022",01313,0005,,South side of East 59th Street between Lexington and Park Avenues,1968,38,,"55/65",Completed,Commercial,,,Arcade; Plaza (in C5-3); Plaza (in C6-4),Yes,No,No,No,No,No,No,No,No,No,No,No,No,Yes,Plaza (in C5-3); Plaza (in C6-4),,William Lescaze & Associates,William Lescaze & Associates,Arcade 4210.00 sf; Plaza (in C5-3) 4786.00 sf; Plaza (in C6-4) 398.00 sf,24 Hours,Arcade: 24 Hours; Plaza (in C5-3): 24 Hours; Plaza (in C6-4): 24 Hours,Yes,,,None,Arcade: None; Plaza (in C5-3): None; Plaza (in C6-4): None,Yes,,,,,,,,,,,,,,,,,,,,,,,,,,"Full/Partial",40.762219,-73.969317 ,0992750,0216975
M050007,Manhattan,1,05,115,EAST 57 STREET,10022,"115 EAST 57 STREET, New York, NY 10022",01312,7501,Galleria,North side of East 57th Street between Lexington and Park Avenues,1974,57,,"40/72",Completed,"Co-op/Condo; Commercial; Residential",,,Covered Pedestrian Space,No,Yes,No,No,No,No,No,No,No,No,No,No,No,No,,,"David Kenneth Specter/Philip Birnbaum",David Kenneth Specter,Covered Pedestrian Space 7419.29 sf,Restricted Hours,"Covered Pedestrian Space: Restricted Hours (Monday through Saturday, 8:00 am to 10:00 pm, Sunday, 8:00 am to 6:00 pm)",,"Monday through Saturday, 8:00 am to 10:00 pm, Sunday, 8:00 am to 6:00 pm",,"Climate Control; Lighting; Other Required; Planting; Plaque/Sign; Programs; Retail Frontage; Seating; Tables; Trees within Space; Water Feature","Covered Pedestrian Space: Climate Control; Covered Pedestrian Space: Lighting; Covered Pedestrian Space: Other Required (skylight); Covered Pedestrian Space: Planting; Covered Pedestrian Space: Plaque/Sign (stanchion with signs at southern entrance stating ""public seating area;"" plaque at northern and southern entrance); Covered Pedestrian Space: Programs (public events scheduled for at least 60 days each calendar year); Covered Pedestrian Space: Retail Frontage; Covered Pedestrian Space: Seating (52 movable chairs, bench); Covered Pedestrian Space: Tables (14); Covered Pedestrian Space: Trees within Space (4); Covered Pedestrian Space: Water Feature (fountain)",,,,Yes,,,,,Yes,,Yes,"stanchion with signs at southern entrance stating ""public seating area;"" plaque at northern and southern entrance",public events scheduled for at least 60 days each calendar year,,Yes,"52 movable chairs, bench",,14,,4,fountain,skylight,Other Permitted,Covered Pedestrian Space: Other Permitted (food service kiosk; restaurant seating located in the lowest tier of the terraces and along the western wall running approximately 50 feet south),,food service kiosk; restaurant seating located in the lowest tier of the terraces and along the western wall running approximately 50 feet south,"Full/Partial",40.761752,-73.969739 ,0992633,0216805
M050008,Manhattan,1,05,9,WEST 57 STREET,10019,"9 WEST 57 STREET, New York, NY 10019",01273,0022,Solow,North side of West 57th Street between Fifth and Sixth Avenues,1972,49,,"51/67",Completed,Commercial,,,Arcade; Plaza,Yes,No,No,No,No,Yes,No,No,No,No,No,No,No,No,,Solow Building Co.,"Skidmore, Owings & Merrill","Skidmore, Owings & Merrill",Arcade 10970.90 sf; Plaza 17596.90 sf,24 Hours,Arcade: 24 Hours; Plaza: 24 Hours,Yes,,,None,Arcade: None; Plaza: None,Yes,,,,,,,,,,,,,,,,,,,,,,,,,,"Full/Partial",40.763886,-73.974991 ,0991178,0217582
M050009,Manhattan,1,05,58,WEST 58 STREET,10019,"58 WEST 58 STREET, New York, NY 10019",01273,7501,,South side of West 58th Street between Fifth and Sixth Avenues,1968,34,,"39/65",Completed,"Co-op/Condo; Residential",,,Arcade; Plaza,Yes,No,No,No,No,Yes,No,No,No,No,No,No,No,No,,,Samuel Paul & Seymour Jarmul Architects,Samuel Paul & Seymour Jarmul Architects,Arcade 1500.00 sf; Plaza 4918.48 sf,24 Hours,Arcade: 24 Hours; Plaza: 24 Hours,Yes,,,None,Arcade: None; Plaza: None,Yes,,,,,,,,,,,,,,,,,,,,,,,,,,"Full/Partial",40.764521,-73.976167 ,0990852,0217813
M050010,Manhattan,1,05,211,WEST 56 STREET,10019,"211 WEST 56 STREET, New York, NY 10019",01028,0017,Carnegie Mews,Northeast corner of West 56th Street and Broadway,1976,36,,"53/69",Completed,Hotel; Residential,,,Plaza,No,No,No,No,No,Yes,No,No,No,No,No,No,No,No,,Ralph Kern,Philip Birnbaum,Philip Birnbaum,Plaza 4773.50 sf,24 Hours,Plaza: 24 Hours,Yes,,,Other Required; Planting,Plaza: Other Required (access ramp from West 56th Street to Plaza); Plaza: Planting (planters adjacent to Plaza entry stairs and ramp),,,,,,,,,,,planters adjacent to Plaza entry stairs and ramp,,,,,,,,,,,access ramp from West 56th Street to Plaza,,,,,"Full/Partial",40.765474,-73.981470 ,0989383,0218160
M050011,Manhattan,1,05,888,SEVENTH AVENUE,10106,"888 SEVENTH AVENUE, New York, NY 10106",01028,0029,,West side of Seventh Avenue between West 56th and 57th Streets,1970,45,,"19/68",Completed,Commercial,,,Plaza,No,No,No,No,No,Yes,No,No,No,No,No,No,No,No,,Arlen Realty & Development Corp.,Emery Roth & Sons,Emery Roth & Sons; Thomas Balsley Associates (for alteration),Plaza 12317.00 sf,24 Hours,Plaza: 24 Hours,Yes,,,None,Plaza: None,Yes,,,,,,,,,,,,,,,,,,,,,,,,,,"Full/Partial",40.765361,-73.980881 ,0989546,0218119
M050012,Manhattan,1,05,118,WEST 57 STREET,10019,"118 WEST 57 STREET, New York, NY 10019",01009,0019,Le Parker Meridien Hotel,South side of West 57th Street between Sixth and Seventh Avenues,1979,40,,"12/74, 20/78",Completed,Hotel,,,Plaza; Through Block Arcade,No,No,No,No,No,Yes,No,No,No,Yes,No,No,No,No,,Jack Parker,Philip Birnbaum,Philip Birnbaum,Plaza 3000.00 sf; Through Block Arcade 6820.00 sf,24 Hours; Restricted Hours,Plaza: 24 Hours; Through Block Arcade: Restricted Hours (7:00 am to midnight),Yes,7:00 am to midnight,,"Artwork; Lighting; Other Required; Planting; Plaque/Sign; Retail Frontage; Seating; Tables; Trees within Space","Plaza: Planting; Plaza: Seating (planter ledge); Plaza: Trees within Space (3 of four-inch caliper, with other trees in planters); Through Block Arcade: Artwork (mural by Richard Haas or equivalent artist at northern portion); Through Block Arcade: Lighting (minimum 8 foot candles); Through Block Arcade: Other Required (skylight above middle portion); Through Block Arcade: Plaque/Sign; Through Block Arcade: Retail Frontage; Through Block Arcade: Seating (54 movable chairs); Through Block Arcade: Tables (18 tables of 34-inch diameter)",,mural by Richard Haas or equivalent artist at northern portion,,,,,,,minimum 8 foot candles,,Yes,Yes,,,Yes,planter ledge; 54 movable chairs,,18 tables of 34-inch diameter,,"3 of four-inch caliper, with other trees in planters",,skylight above middle portion,,,,,"Full/Partial",40.764241,-73.978496 ,0990207,0217711
M050013,Manhattan,1,05,40,WEST 57 STREET,10019,"40 WEST 57 STREET, New York, NY 10019",01272,0063,,South side of West 57th Street between Fifth and Sixth Avenues,1972,33,,"35/68",Completed,Commercial,,,Plaza; Through Block Arcade,No,No,No,No,No,Yes,No,No,No,Yes,No,No,No,No,,Samuel Lefrak,Jack Brown,Jack Brown,Plaza 5183.74 sf; Through Block Arcade 4366.12 sf,24 Hours; Restricted Hours,Plaza: 24 Hours; Through Block Arcade: Restricted Hours (8:00 am to midnight),Yes,8:00 am to midnight,,Lighting; Planting,Plaza: Planting (on West 56th Street); Through Block Arcade: Lighting; Through Block Arcade: Planting,,,,,,,,,Yes,,on West 56th Street,,,,,,,,,,,,,,,,"Full/Partial",40.763670,-73.976362 ,0990798,0217503
M050014,Manhattan,1,05,725,FIFTH AVENUE,10022,"725 FIFTH AVENUE, New York, NY 10022",01292,7501,Trump Tower,East side of Fifth Avenue between East 56th and 57th Streets,1983,58,,"27/80",Completed,"Co-op/Condo; Commercial; Residential",,,Covered Pedestrian Space; Landscaped Terraces; Passageway,No,Yes,No,No,No,No,No,No,No,No,No,No,No,Yes,Landscaped Terraces; Passageway,Donald Trump,Swanke Hayden Connell Architects,Swanke Hayden Connell Architects; Thomas Balsley Associates,Covered Pedestrian Space 6626.00 sf; Landscaped Terraces 6336.00 sf; Passageway 0.00 sf,Closing for Events; Restricted Hours,Covered Pedestrian Space: Closing for Events (up to four closings annually by prior authorization); Covered Pedestrian Space: Restricted Hours (8:00 am to 10:00 pm); Landscaped Terraces: Restricted Hours (open during store hours); Passageway: Restricted Hours (8:00 am to 10:00 pm),,open during store hours; 8:00 am to 10:00 pm; 8:00 am to 10:00 pm,up to four closings annually by prior authorization,"Climate Control; Elevator; Escalator; Lighting; Litter Receptacles; Other Required; Planting; Plaque/Sign; Restrooms; Retail Frontage; Seating; Tables; Trees within Space; Water Feature","Covered Pedestrian Space: Climate Control; Covered Pedestrian Space: Elevator (at least 2 elevators must go to concourse, street, and all upper levels); Covered Pedestrian Space: Escalator (escalators must go to concourse, street, and all upper levels); Covered Pedestrian Space: Lighting; Covered Pedestrian Space: Litter Receptacles; Covered Pedestrian Space: Other Required (skylight); Covered Pedestrian Space: Planting (Covered Pedestrian Space); Covered Pedestrian Space: Plaque/Sign (14); Covered Pedestrian Space: Restrooms (2 on concourse level near Covered Pedestrian Space); Covered Pedestrian Space: Retail Frontage; Covered Pedestrian Space: Seating (165 linear feet including 22-foot bench seating directly across from elevator near Fifth Avenue entrance); Covered Pedestrian Space: Tables (30 movable); Covered Pedestrian Space: Trees within Space (4 at street level, 4 at concourse level); Covered Pedestrian Space: Water Feature (waterfall); Landscaped Terraces: Lighting; Landscaped Terraces: Other Required (Landscaped Terrace (Fifth Floor), Passageway: multiple pedestrian connections to Niketown); Landscaped Terraces: Planting (Landscaped Terrace (Fourth Floor), Landscaped Terrace (Fifth Floor)); Landscaped Terraces: Seating (Landscaped Terrace (Fourth Floor): benches; Landscaped Terrace (Fifth Floor): 64 fixed seats, 84 movable seats); Landscaped Terraces: Tables (Landscaped Terrace (Fourth Floor): 6 movable; Landscaped Terrace (Fifth Floor): 21 movable); Landscaped Terraces: Water Feature (Landscaped Terrace (Fifth Floor): fountain); Passageway: Climate Control; Passageway: Lighting",,,,Yes,,"at least 2 elevators must go to concourse, street, and all upper levels","escalators must go to concourse, street, and all upper levels",,Yes,Yes,"Landscaped Terrace (Fourth Floor), Landscaped Terrace (Fifth Floor); Covered Pedestrian Space",14,,2 on concourse level near Covered Pedestrian Space,Yes,"Landscaped Terrace (Fourth Floor): benches; Landscaped Terrace (Fifth Floor): 64 fixed seats, 84 movable seats; 165 linear feet including 22-foot bench seating directly across from elevator near Fifth Avenue entrance",,Landscaped Terrace (Fourth Floor): 6 movable; Landscaped Terrace (Fifth Floor): 21 movable; 30 movable,,"4 at street level, 4 at concourse level",Landscaped Terrace (Fifth Floor): fountain; waterfall,"Landscaped Terrace (Fifth Floor), Passageway: multiple pedestrian connections to Niketown; skylight",,,,,"Full/Partial",40.762311,-73.973894 ,0991482,0217008
M050015,Manhattan,1,05,590,MADISON AVENUE,10022,"590 MADISON AVENUE, New York, NY 10022",01292,0015,,Southwest corner of East 57th Street and Madison Avenue,1982,43,,"6/78",Completed,Commercial,,Northwest corner of East 56th Street and Madison Avenue,Arcade; Covered Pedestrian Space; Seating Area; Through Block Arcade; Urban Plaza,Yes,Yes,No,No,No,No,No,No,No,Yes,No,No,Yes,Yes,Seating Area,,Edward Larrabee Barnes,Edward Larrabee Barnes; Zion and Breen; Robert A. M. Stern (for alteration in 1995),Arcade 1851.00 sf; Covered Pedestrian Space 8261.00 sf; Seating Area 0.00 sf; Through Block Arcade 4669.00 sf; Urban Plaza 1821.00 sf,24 Hours; Closing for Events; Restricted Hours,"Arcade: 24 Hours; Covered Pedestrian Space: Closing for Events (may be closed to the public with advance notice for 6 private and 6 local community and not-for-profit organization events per year, starting no earlier than 3:00 pm weekdays or 5:00 pm weekend days; a sign giving notice of such closing must be posted at each entrance to the indoor public spaces for seven days prior to the event); Covered Pedestrian Space: Restricted Hours (8:00 am to 10:00 pm); Seating Area: Closing for Events (may be closed to the public with advance notice for 6 private and 6 local community and not-for-profit organization events per year, starting no earlier than 3:00 pm weekdays or 5:00 pm weekend days; a sign giving notice of such closing must be posted at each entrance to the indoor public spaces for seven days prior to the event); Seating Area: Restricted Hours (8:00 am to 10:00 pm); Through Block Arcade: Closing for Events (may be closed to the public with advance notice for 6 private and 6 local community and not-for-profit organization events per year, starting no earlier than 3:00 pm weekdays or 5:00 pm weekend days; a sign giving notice of such closing must be posted at each entrance to the indoor public spaces for seven days prior to the event); Through Block Arcade: Restricted Hours (8:00 am to 10:00 pm); Urban Plaza: 24 Hours",Yes,8:00 am to 10:00 pm; 8:00 am to 10:00 pm; 8:00 am to 10:00 pm,"may be closed to the public with advance notice for 6 private and 6 local community and not-for-profit organization events per year, starting no earlier than 3:00 pm weekdays or 5:00 pm weekend days; a sign giving notice of such closing must be posted at each entrance to the indoor public spaces for seven days prior to the event; may be closed to the public with advance notice for 6 private and 6 local community and not-for-profit organization events per year, starting no earlier than 3:00 pm weekdays or 5:00 pm weekend days; a sign giving notice of such closing must be posted at each entrance to the indoor public spaces for seven days prior to the event; may be closed to the public with advance notice for 6 private and 6 local community and not-for-profit organization events per year, starting no earlier than 3:00 pm weekdays or 5:00 pm weekend days; a sign giving notice of such closing must be posted at each entrance to the indoor public spaces for seven days prior to the event","Artwork; Food Service; Lighting; Litter Receptacles; None; Other Required; Plaque/Sign; Retail Frontage; Seating; Tables; Trees on Street; Trees within Space; Water Feature","Arcade: None; Covered Pedestrian Space: Artwork (Covered Pedestrian Space, Seating Area: indoor sculpture garden for display of large-scale works of art by major artists of the twentieth century, to be changed two or more times a year); Covered Pedestrian Space: Lighting; Covered Pedestrian Space: Litter Receptacles (Covered Pedestrian Space, Seating Area: 8); Covered Pedestrian Space: Plaque/Sign; Covered Pedestrian Space: Retail Frontage; Covered Pedestrian Space: Seating (Covered Pedestrian Space, Seating Area: 110 movable chairs); Covered Pedestrian Space: Tables (Covered Pedestrian Space, Seating Area: 32 movable); Covered Pedestrian Space: Trees within Space (Covered Pedestrian Space, Seating Area: 8 clusters in recessed planting beds); Seating Area: Artwork (Covered Pedestrian Space, Seating Area: indoor sculpture garden for display of large-scale works of art by major artists of the twentieth century, to be changed two or more times a year); Seating Area: Food Service (food and coffee kiosk); Seating Area: Lighting; Seating Area: Litter Receptacles (Covered Pedestrian Space, Seating Area: 8); Seating Area: Plaque/Sign; Seating Area: Seating (Covered Pedestrian Space, Seating Area: 110 movable chairs); Seating Area: Tables (Covered Pedestrian Space, Seating Area: 32 movable); Seating Area: Trees within Space (Covered Pedestrian Space, Seating Area: 8 clusters in recessed planting beds); Through Block Arcade: Lighting; Through Block Arcade: Litter Receptacles (2); Through Block Arcade: Other Required (access from 8:00 am to 10:00 pm from Through Block Arcade to passageway connecting to adjacent Trump Tower and to Fifth Avenue); Through Block Arcade: Plaque/Sign; Urban Plaza: Lighting; Urban Plaza: Plaque/Sign; Urban Plaza: Seating (66 linear feet of fixed seating); Urban Plaza: Trees on Street (14); Urban Plaza: Water Feature (sculpture pool)",Yes,"Covered Pedestrian Space, Seating Area: indoor sculpture garden for display of large-scale works of art by major artists of the twentieth century, to be changed two or more times a year; Covered Pedestrian Space, Seating Area: indoor sculpture garden for display of large-scale works of art by major artists of the twentieth century, to be changed two or more times a year",,,,,,food and coffee kiosk,Yes,"Covered Pedestrian Space, Seating Area: 8; Covered Pedestrian Space, Seating Area: 8; 2",,Yes,,,Yes,"Covered Pedestrian Space, Seating Area: 110 movable chairs; Covered Pedestrian Space, Seating Area: 110 movable chairs; 66 linear feet of fixed seating",,"Covered Pedestrian Space, Seating Area: 32 movable; Covered Pedestrian Space, Seating Area: 32 movable",14,"Covered Pedestrian Space, Seating Area: 8 clusters in recessed planting beds; Covered Pedestrian Space, Seating Area: 8 clusters in recessed planting beds",sculpture pool,access from 8:00 am to 10:00 pm from Through Block Arcade to passageway connecting to adjacent Trump Tower and to Fifth Avenue,,,,,"Full/Partial",40.762105,-73.973042 ,0991718,0216933
M050016,Manhattan,1,05,450,PARK AVENUE,10022,"450 PARK AVENUE, New York, NY 10022",01292,0037,,Southwest corner of Park Avenue and East 57th Street,1971,33,,"68/68",Completed,Commercial,,,Plaza,No,No,No,No,No,Yes,No,No,No,No,No,No,No,No,,Peter Sharp,Emery Roth & Sons,Emery Roth & Sons,Plaza 3900.00 sf,24 Hours,Plaza: 24 Hours,Yes,,,Lighting; Other Required; Planting; Seating; Trees on Street; Water Feature,Plaza: Lighting (minimum 5 foot candles); Plaza: Other Required (access from Plaza to lobby); Plaza: Planting (5 planters); Plaza: Seating (3 12-foot benches); Plaza: Trees on Street (8); Plaza: Water Feature (pool),,,,,,,,,minimum 5 foot candles,,5 planters,,,,,3 12-foot benches,,,8,,pool,access from Plaza to lobby,,,,,"Full/Partial",40.761495,-73.971328 ,0992193,0216711
M050017,Manhattan,1,05,230,WEST 27 STREET,10001,"230 WEST 27 STREET, New York, NY 10001",00776,0055,,South side of West 27th Street between Seventh and Eighth Avenues,1974,15,,"2/72",Completed,Community Facility,,,Plaza,No,No,No,No,No,Yes,No,No,No,No,No,No,No,No,,Fashion Institute of Technology Staff Housing Co. Inc.,de Young & Moscowitz,de Young & Moscowitz,Plaza 3093.64 sf,24 Hours,Plaza: 24 Hours,Yes,,,None,Plaza: None,Yes,,,,,,,,,,,,,,,,,,,,,,,,,,"Full/Partial",40.747028,-73.995362 ,0985535,0211439
